"","study_id","study_title","source","doi","url","longitude","latitude"
"445","rayyan-674261159","REMOVAL OF WEIRS AND THE INFLUENCE ON PHYSICAL HABITAT FOR SALMONIDS IN A NORWEGIAN RIVER","RIVER RESEARCH AND APPLICATIONS","10.1002/rra.1529     WE  - Science Citation Index Expanded (SCI-EXPANDED)",NA,16.6702592723909,64.9777588294775
"446","rayyan-674260043","Rapid recovery of recently overexploited winter grazing pastures for reindeer in northern Norway","FUNGAL ECOLOGY","10.1016/j.funeco.2011.08.002     WE  - Science Citation Index Expanded (SCI-EXPANDED)     WE  - Conference Proceedings Citation Index - Science (CPCI-S)",NA,16.6702592723909,64.9777588294775
"447","rayyan-674260645","Compensating White-Tailed Eagle Mortality at the Smola Wind-Power Plant Using Electrocution Prevention Measures","WILDLIFE SOCIETY BULLETIN","10.1002/wsb.263     WE  - Science Citation Index Expanded (SCI-EXPANDED)",NA,16.6702592723909,64.9777588294775
"448","rayyan-674261898","A modification of the hair-trapping method for surveillance of problematic bear activity close to a farm - a case study from the Pasvik Valley in Norway","ANNALES ZOOLOGICI FENNICI","10.5735/086.050.0605     WE  - Science Citation Index Expanded (SCI-EXPANDED)",NA,16.6702592723909,64.9777588294775
"449","rayyan-656138121","A road in the middle of one of the last wild reindeer migration routes in Norway: crossing behaviour and threats to conservation","Rangifer","10.7557/2.33.2.2521",NA,16.6702592723909,64.9777588294775
"450","rayyan-674258437","Abundance and diversity of spiders (Araneae) in barley and young leys","JOURNAL OF ARACHNOLOGY","10.1636/P12-32.1     WE  - Science Citation Index Expanded (SCI-EXPANDED)",NA,16.6702592723909,64.9777588294775
"451","rayyan-674260805","Boom and bust of a moose population: a call for integrated forest management","EUROPEAN JOURNAL OF FOREST RESEARCH","10.1007/s10342-013-0727-9     WE  - Science Citation Index Expanded (SCI-EXPANDED)",NA,16.6702592723909,64.9777588294775
"452","rayyan-674263611","Increased growth and phenolic compounds in bilberry (Vaccinium myrtillus L.) following forest clear-cutting","SCANDINAVIAN JOURNAL OF FOREST RESEARCH","10.1080/02827581.2012.749941",NA,16.6702592723909,64.9777588294775
"453","rayyan-674259634","Learning from the past to predict the future: using archaeological findings and GPS data to quantify reindeer sensitivity to anthropogenic disturbance in Norway","LANDSCAPE ECOLOGY","10.1007/s10980-012-9793-5     WE  - Science Citation Index Expanded (SCI-EXPANDED)",NA,16.6702592723909,64.9777588294775
"454","rayyan-656137738","Selecting Habitat to Survive: The Impact of Road Density on Survival in a Large Carnivore","PloS one","10.1371/journal.pone.0065493",NA,16.6702592723909,64.9777588294775
"455","rayyan-674230847","A systematic review on climate change and geo-environmental factors induced land degradation: Processes, policy-practice gap and its management strategies","Geological Journal","10.1002/gj.4649","https://www.scopus.com/inward/record.uri?eid=2-s2.0-85144073739&doi=10.1002%2fgj.4649&partnerID=40&md5=358be6b5b3c7edbe711fcd9c8869b34b",NA,NA
"456","rayyan-674238261","A Systematic Review on Community Forest Management in Southeast Asia: Current Practices and Impacts on Biodiversity Conservation and Livelihood Quality of Local Communities","Human Ecology Review","10.22459/HER.27.01.2021.01","https://www.scopus.com/inward/record.uri?eid=2-s2.0-85123854006&doi=10.22459%2fHER.27.01.2021.01&partnerID=40&md5=53303e7cbb3d5fea42d382b4a2c9ca86",NA,NA
"457","rayyan-674230892","A systematic review on the ecosystem services provided by green infrastructure","Urban Forestry and Urban Greening","10.1016/j.ufug.2023.127998","https://www.scopus.com/inward/record.uri?eid=2-s2.0-85162267239&doi=10.1016%2fj.ufug.2023.127998&partnerID=40&md5=d146eb2d3165be57b0f89d0dc9903b84",NA,NA
"458","rayyan-674230391","A systematic review on the effectiveness of crop architecture-related in-field measures for promoting ground-breeding farmland birds","Journal for Nature Conservation","10.1016/j.jnc.2023.126515","https://www.scopus.com/inward/record.uri?eid=2-s2.0-85177852950&doi=10.1016%2fj.jnc.2023.126515&partnerID=40&md5=a39ac6dc557d93a551688e5aa40d2cb6",NA,NA
"459","rayyan-674234144","Advancing avian road ecology research through systematic review","Transportation Research Part D: Transport and Environment","10.1016/j.trd.2022.103375","https://www.scopus.com/inward/record.uri?eid=2-s2.0-85132766392&doi=10.1016%2fj.trd.2022.103375&partnerID=40&md5=35260e3f3eed61aaa2fc344aedb4ca35",NA,NA
"460","rayyan-674236017","What is the future of abandoned agricultural lands? A systematic review of alternative trajectories in Europe","Land Use Policy","10.1016/j.landusepol.2021.105833","https://www.scopus.com/inward/record.uri?eid=2-s2.0-85118497538&doi=10.1016%2fj.landusepol.2021.105833&partnerID=40&md5=db3c8055d0d56449aa1738e510bf085d",NA,NA
"461","rayyan-674260893","Effect of the season and forest management on the visual quality of the nature-based tourism environment: a case from Finnish Lapland","SCANDINAVIAN JOURNAL OF FOREST RESEARCH","10.1080/02827581.2016.1241892     WE  - Science Citation Index Expanded (SCI-EXPANDED)     WE  - Social Science Citation Index (SSCI)",NA,25.657384334547,65.0157895974991
"462","rayyan-674253690","Assessing the impact of human trampling on vegetation: a systematic review and meta-analysis of experimental evidence","PEERJ","10.7717/peerj.360     WE  - Science Citation Index Expanded (SCI-EXPANDED)",NA,NA,NA
"463","rayyan-674232727","The rise of the Functional Response in invasion science: a systematic review","NeoBiota","10.3897/neobiota.85.98902","https://www.scopus.com/inward/record.uri?eid=2-s2.0-85163294148&doi=10.3897%2fneobiota.85.98902&partnerID=40&md5=f46a500bb39e540d2fa7ae2d9c8534d7",NA,NA
"464","rayyan-674259658","Effects of land tenure and protected areas on ecosystem services and land use preferences in Norway","LAND USE POLICY","10.1016/j.landusepol.2015.08.018     WE  - Social Science Citation Index (SSCI)",NA,16.6702592723909,64.9777588294775
"465","rayyan-674234941","Effects of stakeholder empowerment on crane population and agricultural production","Ecological Modelling","10.1016/j.ecolmodel.2020.109396","https://www.scopus.com/inward/record.uri?eid=2-s2.0-85098889939&doi=10.1016%2fj.ecolmodel.2020.109396&partnerID=40&md5=6efa51d7a0cf7c38a06dc0b904d40db0",17.062431988005,62.7342098610845
"466","rayyan-674261669","Envisioning upland futures: Stakeholder responses to scenarios for Europe's mountain landscapes","JOURNAL OF RURAL STUDIES","10.1016/j.jrurstud.2007.04.001     WE  - Social Science Citation Index (SSCI)",NA,16.6702592723909,64.9777588294775
"467","rayyan-674260312","Urban bird community composition influenced by size of urban green spaces, presence of native forest, and urbanization","URBAN ECOSYSTEMS","10.1007/s11252-017-0706-x     WE  - Science Citation Index Expanded (SCI-EXPANDED)     WE  - Social Science Citation Index (SSCI)",NA,16.6702592723909,64.9777588294775
"468","rayyan-674232281","Urbanisation and land-cover change affect functional, but not compositional turnover of bird communities","Urban Ecosystems","10.1007/s11252-022-01258-z","https://www.scopus.com/inward/record.uri?eid=2-s2.0-85132586311&doi=10.1007%2fs11252-022-01258-z&partnerID=40&md5=10ed130156d985a91e0dc417b1f3de8a",16.6702592723909,64.9777588294775
"469","rayyan-674233897","Using genomics to guide seed-sourcing at the right taxonomical level for ecological restoration projects: The complex case of Carex bigelowii s.lat. in Norway","Ecology and Evolution","10.1002/ece3.8350","https://www.scopus.com/inward/record.uri?eid=2-s2.0-85119050790&doi=10.1002%2fece3.8350&partnerID=40&md5=422dae7203272215fb49ef65560eca18",NA,NA
"470","rayyan-674258958","Old-growth forest floor richness increases with red deer herbivory intensity","FOREST ECOLOGY AND MANAGEMENT","10.1016/j.foreco.2013.08.031     WE  - Science Citation Index Expanded (SCI-EXPANDED)",NA,16.6702592723909,64.9777588294775
"471","rayyan-674236421","Optimal continuous cover forest management with a lower bound constraint on dead wood","Forest Science","10.1093/forsci/fxz073","https://www.scopus.com/inward/record.uri?eid=2-s2.0-85084110176&doi=10.1093%2fforsci%2ffxz073&partnerID=40&md5=bd4023957c4d86492f56f8c9eca7a222",NA,NA
"472","rayyan-674234753","Optimizing forest management for climate impact and economic profitability under alternative initial stand age structures","Biomass and Bioenergy","10.1016/j.biombioe.2021.106027","https://www.scopus.com/inward/record.uri?eid=2-s2.0-85101823862&doi=10.1016%2fj.biombioe.2021.106027&partnerID=40&md5=adbad4510ea18a7092be4fcd984ebf4b",NA,NA
"473","rayyan-674234518","Estimating societal benefits from Nordic catchments: An integrative approach using a final ecosystem services framework","PLoS ONE","10.1371/journal.pone.0252352","https://www.scopus.com/inward/record.uri?eid=2-s2.0-85107001146&doi=10.1371%2fjournal.pone.0252352&partnerID=40&md5=cc53727c4db2c7a37c16065df00b6b1b",16.6702592723909,64.9777588294775
"474","rayyan-674232957","Natural and anthropogenic drivers of escaped farmed salmon occurrence and introgression into wild Norwegian Atlantic salmon populations","ICES Journal of Marine Science","10.1093/icesjms/fsac060","https://www.scopus.com/inward/record.uri?eid=2-s2.0-85132942967&doi=10.1093%2ficesjms%2ffsac060&partnerID=40&md5=1d41e7de3fa0080154292847393cebaf",16.6702592723909,64.9777588294775
"475","rayyan-674262685","Estimating the benefits of recreation-oriented management in state-owned commercial forests in Finland: A choice experiment","JOURNAL OF FOREST ECONOMICS","10.1016/j.jfe.2014.10.003     WE  - Science Citation Index Expanded (SCI-EXPANDED)     WE  - Social Science Citation Index (SSCI)",NA,25.657384334547,65.0157895974991
"476","rayyan-674234613","Assessing recovery of alpine spoil heaps by vascular plant, bryophyte, and lichen functional traits","Restoration Ecology","10.1111/rec.13257","https://www.scopus.com/inward/record.uri?eid=2-s2.0-85092097337&doi=10.1111%2frec.13257&partnerID=40&md5=61ecfb76f3d50a0f79ac0c4d53d76d1c",16.6702592723909,64.9777588294775
"477","rayyan-674236293","Assessing the Beneﬁts of Forested Riparian Zones: A Qualitative Index of Riparian Integrity Is Positively Associated with Ecological Status in European Streams","Water (Switzerland)","10.3390/W12041178","https://www.scopus.com/inward/record.uri?eid=2-s2.0-85085148061&doi=10.3390%2fW12041178&partnerID=40&md5=1b7071798bfd6efa8590647b9e643a93",16.6702592723909,64.9777588294775
"478","rayyan-674236293","Assessing the Beneﬁts of Forested Riparian Zones: A Qualitative Index of Riparian Integrity Is Positively Associated with Ecological Status in European Streams","Water (Switzerland)","10.3390/W12041178","https://www.scopus.com/inward/record.uri?eid=2-s2.0-85085148061&doi=10.3390%2fW12041178&partnerID=40&md5=1b7071798bfd6efa8590647b9e643a93",NA,NA
"479","rayyan-674236293","Assessing the Beneﬁts of Forested Riparian Zones: A Qualitative Index of Riparian Integrity Is Positively Associated with Ecological Status in European Streams","Water (Switzerland)","10.3390/W12041178","https://www.scopus.com/inward/record.uri?eid=2-s2.0-85085148061&doi=10.3390%2fW12041178&partnerID=40&md5=1b7071798bfd6efa8590647b9e643a93",NA,NA
"480","rayyan-674236293","Assessing the Beneﬁts of Forested Riparian Zones: A Qualitative Index of Riparian Integrity Is Positively Associated with Ecological Status in European Streams","Water (Switzerland)","10.3390/W12041178","https://www.scopus.com/inward/record.uri?eid=2-s2.0-85085148061&doi=10.3390%2fW12041178&partnerID=40&md5=1b7071798bfd6efa8590647b9e643a93",NA,NA
"481","rayyan-674236293","Assessing the Beneﬁts of Forested Riparian Zones: A Qualitative Index of Riparian Integrity Is Positively Associated with Ecological Status in European Streams","Water (Switzerland)","10.3390/W12041178","https://www.scopus.com/inward/record.uri?eid=2-s2.0-85085148061&doi=10.3390%2fW12041178&partnerID=40&md5=1b7071798bfd6efa8590647b9e643a93",NA,NA
"482","rayyan-674258918","Evolution of Land Cover and Ecosystem Services in the Frame of Pastoral Functional Categories: A Case Study in Swedish Lapland","SUSTAINABILITY","10.3390/su12010390     WE  - Science Citation Index Expanded (SCI-EXPANDED)     WE  - Social Science Citation Index (SSCI)",NA,17.062431988005,62.7342098610845
"483","rayyan-674259206","Ex ante evaluation of a PES system: Safeguarding recreational environments for nature-based tourism","JOURNAL OF RURAL STUDIES","10.1016/j.jrurstud.2017.03.011     WE  - Social Science Citation Index (SSCI)",NA,25.657384334547,65.0157895974991
"484","rayyan-674232193","Exploring the potential of circular economy to mitigate pressures on biodiversity","Global Environmental Change","10.1016/j.gloenvcha.2022.102625","https://www.scopus.com/inward/record.uri?eid=2-s2.0-85144051235&doi=10.1016%2fj.gloenvcha.2022.102625&partnerID=40&md5=c19cc87277de36fae9f7384656c52b9b",25.657384334547,65.0157895974991
"485","rayyan-674236151","Near-natural forests harbor richer saproxylic beetle communities than those in intensively managed forests","Forest Ecology and Management","10.1016/j.foreco.2020.118124","https://www.scopus.com/inward/record.uri?eid=2-s2.0-85082758192&doi=10.1016%2fj.foreco.2020.118124&partnerID=40&md5=278053e5d5c4b31eb379d8f4d58cd3ea",16.6702592723909,64.9777588294775
"486","rayyan-674259878","Drivers of treeline shift in different European mountains","CLIMATE RESEARCH","10.3354/cr01465     WE  - Science Citation Index Expanded (SCI-EXPANDED)",NA,16.6702592723909,64.9777588294775
"487","rayyan-674232318","Farmers’ behavioural determinants of on-farm biodiversity management in Europe: a systematic review","Agriculture and Human Values","10.1007/s10460-023-10505-8","https://www.scopus.com/inward/record.uri?eid=2-s2.0-85176408043&doi=10.1007%2fs10460-023-10505-8&partnerID=40&md5=ba1d702a2a16507f339008dbe436f2d4",NA,NA
"488","rayyan-674259643","Fire Management in The Boreal Forest of Swedish Sapmi: Prescribed Burning and Consideration of Sami Reindeer Herding During 1920-1970","ENVIRONMENTAL MANAGEMENT","10.1007/s00267-021-01503-9",NA,17.062431988005,62.7342098610845
"489","rayyan-674260396","Impact of environmental factors on aquatic biodiversity in roadside stormwater ponds","SCIENTIFIC REPORTS","10.1038/s41598-019-42497-z     WE  - Science Citation Index Expanded (SCI-EXPANDED)",NA,16.6702592723909,64.9777588294775
"490","rayyan-674260613","Forest management optimization across spatial scales to reconcile economic and conservation objectives","PLOS ONE","10.1371/journal.pone.0218213     WE  - Science Citation Index Expanded (SCI-EXPANDED)",NA,25.657384334547,65.0157895974991
"491","rayyan-674234838","Forest owners' interest in participation and their compensation claims in voluntary landscape value trading: The case of wind power parks in Finland","Forest Policy and Economics","10.1016/j.forpol.2020.102382","https://www.scopus.com/inward/record.uri?eid=2-s2.0-85099217262&doi=10.1016%2fj.forpol.2020.102382&partnerID=40&md5=3e32665224e795f681570abf027de16b",25.657384334547,65.0157895974991
"492","rayyan-674236298","Foundation of nature reserves after disasters and different modes of remembrance","Disaster Prevention and Management: An International Journal","10.1108/DPM-10-2019-0323","https://www.scopus.com/inward/record.uri?eid=2-s2.0-85083774016&doi=10.1108%2fDPM-10-2019-0323&partnerID=40&md5=996d736ad527b38412326dbc7ffb5f1c",17.062431988005,62.7342098610845
"493","rayyan-674264216","Framing the peat: the political ecology of Finnish mire policies and law","MIRES AND PEAT","10.19189/MaP.2018.OMB.370     WE  - Science Citation Index Expanded (SCI-EXPANDED)     WE  - Social Science Citation Index (SSCI)",NA,25.657384334547,65.0157895974991
"494","rayyan-674234935","Non-native Species Surrounding Protected Areas Influence the Community of Non-native Species Within Them","Frontiers in Ecology and Evolution","10.3389/fevo.2020.625137","https://www.scopus.com/inward/record.uri?eid=2-s2.0-85099758280&doi=10.3389%2ffevo.2020.625137&partnerID=40&md5=87312f8a72804bea3790756df9ae0496",16.6702592723909,64.9777588294775
"495","rayyan-674259458","North Atlantic Islands with native and alien trees: are there differences in diversity and species-area relationships?","JOURNAL OF VEGETATION SCIENCE","10.1111/jvs.12045     WE  - Science Citation Index Expanded (SCI-EXPANDED)",NA,16.6702592723909,64.9777588294775
"496","rayyan-674262699","Goose management schemes to resolve conflicts with agriculture: Theory, practice and effects","AMBIO","10.1007/s13280-016-0884-4     WE  - Science Citation Index Expanded (SCI-EXPANDED)",NA,16.6702592723909,64.9777588294775
"497","rayyan-674261875","Governance and management dynamics of landscape restoration at multiple scales: Learning from successful environmental managers in Sweden","JOURNAL OF ENVIRONMENTAL MANAGEMENT","10.1016/j.jenvman.2017.03.019     WE  - Science Citation Index Expanded (SCI-EXPANDED)     WE  - Social Science Citation Index (SSCI)",NA,17.062431988005,62.7342098610845
"498","rayyan-674257384","Long-Term Increase in Aboveground Carbon Stocks Following Exclusion of Grazers and Forest Establishment in an Alpine Ecosystem","ECOSYSTEMS","10.1007/s10021-014-9784-2     WE  - Science Citation Index Expanded (SCI-EXPANDED)",NA,16.6702592723909,64.9777588294775
"499","rayyan-656138789","Habitat connectivity and matrix restoration: the wider implications of agri-environment schemes","Journal of Applied Ecology","10.1111/j.1365-2664.2006.01146.x",NA,NA,NA
"500","rayyan-674234350","How does being solo in nature affect well-being? Evidence from norway, germany and new zealand","International Journal of Environmental Research and Public Health","10.3390/ijerph18157897","https://www.scopus.com/inward/record.uri?eid=2-s2.0-85111060372&doi=10.3390%2fijerph18157897&partnerID=40&md5=c1956d9b54646535d346bf789af0915b",16.6702592723909,64.9777588294775
"501","rayyan-674259529","FOREST EXPANSION AS EXPLAINED BY CLIMATE CHANGE AND CHANGES IN LAND USE: A STUDY FROM BERGEN, WESTERN NORWAY","GEOGRAFISKA ANNALER SERIES A-PHYSICAL GEOGRAPHY","10.1111/geoa.12056     WE  - Science Citation Index Expanded (SCI-EXPANDED)",NA,16.6702592723909,64.9777588294775
"502","rayyan-674264834","Norwegian Landscapes: An Assessment of the Aesthetical Visual Dimensions of Some Rural Destinations in Norway","SCANDINAVIAN JOURNAL OF HOSPITALITY AND TOURISM","10.1080/15022250.2015.1014129     WE  - Social Science Citation Index (SSCI)     WE  - Conference Proceedings Citation Index - Social Science &amp; Humanities (CPCI-SSH)",NA,NA,NA
"503","rayyan-674261469","The effect of phosphorus application and balance on concentrations in streams from agricultural dominated catchments in Norway","ACTA AGRICULTURAE SCANDINAVICA SECTION B-SOIL AND PLANT SCIENCE","10.1080/09064710.2013.872290     WE  - Science Citation Index Expanded (SCI-EXPANDED)",NA,16.6702592723909,64.9777588294775
"504","rayyan-656137835","How effective are European agrienvironment schemes in conserving and promoting biodiversity?","Journal of Applied Ecology","10.1111/j.1365-2664.2003.00868.x",NA,16.6702592723909,64.9777588294775
"505","rayyan-674267479","How stakeholder representatives cope with collaboration in the Swedish moose management system","HUMAN DIMENSIONS OF WILDLIFE","10.1080/10871209.2019.1698081",NA,17.062431988005,62.7342098610845
"506","rayyan-674260444","Implementation of Forest Act habitats in Finland:: Does it protect the right habitats for threatened species?","FOREST ECOLOGY AND MANAGEMENT","10.1016/j.foreco.2007.01.044     WE  - Science Citation Index Expanded (SCI-EXPANDED)",NA,25.657384334547,65.0157895974991
"507","rayyan-674262953","Evaluation of Landscape-Level Grazing Capacity for Domestic Sheep in Alpine Rangelands","RANGELAND ECOLOGY & MANAGEMENT","10.2111/REM-D-12-00177.1     WE  - Science Citation Index Expanded (SCI-EXPANDED)",NA,16.6702592723909,64.9777588294775
"508","rayyan-674269397","Adaptive Diet Strategy of the Wolf (Canis lupus L.) in Europe: a Review","ACTA ZOOLOGICA BULGARICA",NA,NA,16.6702592723909,64.9777588294775
"509","rayyan-656137765","Implementation of the first adaptive management plan for a European migratory waterbird population: The case of the Svalbard pink-footed goose Anser brachyrhynchus","Ambio","10.1007/s13280-016-0888-0",NA,16.6702592723909,64.9777588294775
"510","rayyan-674260621","Do conservation measures in forest work? A comparison of three area-based conservation tools for wood-living species in boreal forests","FOREST ECOLOGY AND MANAGEMENT","10.1016/j.foreco.2014.06.036     WE  - Science Citation Index Expanded (SCI-EXPANDED)",NA,16.6702592723909,64.9777588294775
"511","rayyan-674263125","Reactive forest management can also be proactive for wood-living beetles in hollow oak trees","BIOLOGICAL CONSERVATION","10.1016/j.biocon.2014.09.034     WE  - Science Citation Index Expanded (SCI-EXPANDED)",NA,16.6702592723909,64.9777588294775
"512","rayyan-674264420","Landscape characteristics explain large-scale variation in demographic traits in forest grouse","LANDSCAPE ECOLOGY","10.1007/s10980-013-9960-3     WE  - Science Citation Index Expanded (SCI-EXPANDED)",NA,16.6702592723909,64.9777588294775
"513","rayyan-674258838","Composition of the sooty blotch and flyspeck complex on apple in Norway is influenced by location and management practices","EUROPEAN JOURNAL OF PLANT PATHOLOGY","10.1007/s10658-014-0548-9     WE  - Science Citation Index Expanded (SCI-EXPANDED)",NA,16.6702592723909,64.9777588294775
"514","rayyan-674266008","From pollen percentage to regional vegetation cover - A new insight into cultural landscape development in western Norway","REVIEW OF PALAEOBOTANY AND PALYNOLOGY","10.1016/j.revpalbo.2015.02.005     WE  - Science Citation Index Expanded (SCI-EXPANDED)",NA,16.6702592723909,64.9777588294775
"515","rayyan-674267492","Cultural landscape development on a west-east gradient in western Norway - potential of the Landscape Reconstruction Algorithm (LRA)","JOURNAL OF ARCHAEOLOGICAL SCIENCE","10.1016/j.jas.2015.04.015     WE  - Science Citation Index Expanded (SCI-EXPANDED)     WE  - Social Science Citation Index (SSCI)     WE  - Arts &amp; Humanities Citation Index (A&amp;HCI)",NA,16.6702592723909,64.9777588294775
"516","rayyan-674261813","Indicators of sustainable forestry: The association between wildlife species and forest structure in Finland","ECOLOGICAL INDICATORS","10.1016/j.ecolind.2009.06.019     WE  - Science Citation Index Expanded (SCI-EXPANDED)",NA,25.657384334547,65.0157895974991
"517","rayyan-674234559","Integrating Land Use, Ecosystem Service, and Human Well-Being: A Systematic Review","Sustainability (Switzerland)","10.3390/su14116926","https://www.scopus.com/inward/record.uri?eid=2-s2.0-85132037658&doi=10.3390%2fsu14116926&partnerID=40&md5=0d0b30d4296672933b4f67cc33f063c8",NA,NA
"518","rayyan-674234255","A Conﬂict between Traditional Flood Measures and Maintaining River Ecosystems? A Case Study Based upon the River Lærdal, Norway","Water (Switzerland)","10.3390/w13141884","https://www.scopus.com/inward/record.uri?eid=2-s2.0-85111083813&doi=10.3390%2fw13141884&partnerID=40&md5=71a4010c744ab3124bfad706d7448170",16.6702592723909,64.9777588294775
"519","rayyan-674262673","Irresponsible responsible tourism; observations from nature areas in Norway","JOURNAL OF TOURISM FUTURES","10.1108/JTF-10-2019-0118     WE  - Emerging Sources Citation Index (ESCI)",NA,16.6702592723909,64.9777588294775
"520","rayyan-674261127","Is enhanced biodiversity protection conflicting with ambitious bioenergy targets in eastern Finland?","JOURNAL OF ENVIRONMENTAL MANAGEMENT","10.1016/j.jenvman.2016.10.065     WE  - Science Citation Index Expanded (SCI-EXPANDED)",NA,25.657384334547,65.0157895974991
"521","rayyan-674257470","KNOWLEDGE PRODUCTION AND LEARNING FOR SUSTAINABLE FOREST LANDSCAPES: THE EUROPEAN CONTINENT'S WEST AND EAST AS A LABORATORY","LESNOY ZHURNAL-FORESTRY JOURNAL","10.17238/issn0536-1036.2019.1.9     WE  - Emerging Sources Citation Index (ESCI)",NA,17.062431988005,62.7342098610845
"522","rayyan-674260702","Land-use planning and designated national interests in Sweden: arctic perspectives on landscape multifunctionality","JOURNAL OF ENVIRONMENTAL PLANNING AND MANAGEMENT","10.1080/09640568.2018.1535430     WE  - Social Science Citation Index (SSCI)",NA,17.062431988005,62.7342098610845
"523","rayyan-674261388","Landscape care paradoxes: Swedish landscape in a European context","GEOFORUM","10.1016/j.geoforum.2012.03.004     WE  - Social Science Citation Index (SSCI)",NA,17.062431988005,62.7342098610845
"524","rayyan-674263755","Landscape perspective on energy forests","BIOMASS & BIOENERGY","10.1016/j.biombioe.2004.08.008",NA,17.062431988005,62.7342098610845
"525","rayyan-674230199","A shift in habitat use patterns of brown trout (Salmo trutta): A behavioural response to macrophyte removal","Journal of Environmental Management","10.1016/j.jenvman.2024.120047","https://www.scopus.com/inward/record.uri?eid=2-s2.0-85181585090&doi=10.1016%2fj.jenvman.2024.120047&partnerID=40&md5=780817edff35838a2f96fe45b80b58f6",16.6702592723909,64.9777588294775
"526","rayyan-656138775","Landscape perspectives on agricultural intensification and biodiversity – ecosystem service management","Ecology Letters","10.1111/j.1461-0248.2005.00782.x",NA,17.062431988005,62.7342098610845
"527","rayyan-674262362","Linking forest management, policy and biodiversity indicators - A comparison of Lithuania and Southern Sweden","FOREST ECOLOGY AND MANAGEMENT","10.1016/j.foreco.2012.11.034     WE  - Science Citation Index Expanded (SCI-EXPANDED)",NA,17.062431988005,62.7342098610845
